{"bundle_count":24,"cells":[{"cell_id":"SL-AUDIT","enforcement":"AUDIT","representation":"SL"},{"cell_id":"SL-GATE","enforcement":"GATE","representation":"SL"},{"cell_id":"CR-AUDIT","enforcement":"AUDIT","representation":"CR"},{"cell_id":"CR-GATE","enforcement":"GATE","representation":"CR"},{"cell_id":"PR-AUDIT","enforcement":"AUDIT","representation":"PR"},{"cell_id":"PR-GATE","enforcement":"GATE","representation":"PR"}],"claim_level":"PREAWARD_DEVELOPMENT_CONFORMANCE","classification":"DEVELOPMENT_ONLY","deterministic_files":["fixtures.resolved.json","manifest.resolved.json","bundles.jsonl","executions.jsonl","invariance.json","summary.json","REPORT.md"],"execution_count":48,"fixture_count":8,"fixture_hash":"sha256:8996f8ea334670c5db462cf5feab7fa5521390f969ac01c3f4f375e3e41ab52d","policies":{"engineering_only":true,"independent_trials":false,"model_calls":0,"runtime_network_calls":0,"synthetic_adapter":true},"release_id":"crosstrace-six-cell-development-v0.1","source_files":[{"path":"LICENSE","sha256":"c71d239df91726fc519c6eb72d318ec65820627232b2f796219e87dcf35d0ab4"},{"path":"pyproject.toml","sha256":"f65882bfc754548cd51027a7eecb05c8d176875eb1073996eee11194f6ca56cf"},{"path":"preaward/__init__.py","sha256":"9d11a67154f00bb0d385e7b82a118df0204b5243b8937b24bb717ba5a66411b0"},{"path":"preaward/README.md","sha256":"8fa185e94d2114ba7cbc1488c935224aad28791c3d3034824ed566a4f66d8a61"},{"path":"preaward/DEVELOPMENT_CLAIMS_BOUNDARY.md","sha256":"058b3671066ec98d71202820b2ba6f4e31042f03644a6bffdb322248b645a77f"},{"path":"preaward/REVIEWER_REPRODUCTION.md","sha256":"3069d2dd653c1842eac0d8c9bf311a5cc5b3fed1dd5e91c2c8d7c8742e3f39c8"},{"path":"preaward/crosstrace_sprint1/__init__.py","sha256":"e8d93c7b43dba7073f9b826a12cd2f96168ab7fd8a26f19706ce64de5bd896df"},{"path":"preaward/crosstrace_sprint1/delivery.py","sha256":"3d96ffcbb08197e02571c205696b31b219528aff63b37deedf6bbfbf864d692b"},{"path":"preaward/crosstrace_sprint2/__init__.py","sha256":"d6eac1ded536c4bceb6b7e0c99e8d62eccc3c74db2d1d6f8bb6b11beee57ffae"},{"path":"preaward/crosstrace_sprint2/crypto_compat.py","sha256":"e4ad8a2c32b59258fdd9e6e0179fa232f2f75c301944b82a9bf2788a4918b6ea"},{"path":"preaward/crosstrace_sprint2/model.py","sha256":"3bf9d41730450f9304a292176b183071f4f45300512c82dfb8e2a90621abdd1b"},{"path":"preaward/crosstrace_sprint2/validation.py","sha256":"3cd9ce6dec067e2faaf22b55c7cb960617369eaceb5a603783c59ab3f81dc4bc"},{"path":"preaward/crosstrace_sprint3/__init__.py","sha256":"544191d9e547c2e69af998d1ad30a868c3d060ac298fe4bc914e6d4ddd2c1812"},{"path":"preaward/crosstrace_sprint3/crypto_compat.py","sha256":"c05efd7b0f2a657973b01b1bd0fa28bf83c88c8115bbaf31b9ff22ef1aa32ff3"},{"path":"preaward/crosstrace_sprint3/model.py","sha256":"8eb603e4b9e73b5e0fe6ccc30268aff5f7047d6521ddfd176835642060915f0c"},{"path":"preaward/crosstrace_sprint3/permit.py","sha256":"4589ce0e9c19db8c2019ed3ec7e29d6a236d3e626b292869c4d304f0aec3058c"},{"path":"preaward/crosstrace_sprint3/gate.py","sha256":"c23ad39308c29066e9cfe8108d7f896f41db887073301cfc041dda09a8ba0e98"},{"path":"preaward/crosstrace_sprint3/README.md","sha256":"41fd83d74ff0372ce4b8310b68172a104d9ec9037fd9873d1c4c678be4cb594e"},{"path":"preaward/crosstrace_sprint4/__init__.py","sha256":"49a05fbe9ce14959a3249c7c2c94e86305033561bc46af5e249d02c21fbda8dc"},{"path":"preaward/crosstrace_sprint4/model.py","sha256":"c7d98d506f580f10b6e8e493c12e373519ce81eb42260d14d55523f00251a3e0"},{"path":"preaward/crosstrace_sprint4/fixtures.py","sha256":"fa807cc79e99ab64b533a83da9d6d4edb432f47c2eadd043c8f530c48b33787c"},{"path":"preaward/crosstrace_sprint4/encoding.py","sha256":"68c7cadd7133a5f4cc72e2c226f89866342eb994b8aa629b53e0e089efbcb20b"},{"path":"preaward/crosstrace_sprint4/chain.py","sha256":"6ee4b920acf24e8722297949148d23eaf97f9a42273a975748d1a1dd349aa334"},{"path":"preaward/crosstrace_sprint4/harness.py","sha256":"ea105fd7251988590285b372e140d735e90cc5d4d36e80e090358490bf9277db"},{"path":"preaward/crosstrace_sprint4/runner.py","sha256":"037b39ac18b08836e29f01b00f91088fdc54c3933012332906bffeec99b9227e"},{"path":"preaward/crosstrace_sprint4/verify.py","sha256":"3c2a8f86318235bb8da790d93aaf9f3998c63a4e8c59d97b3cde4c3815788b44"},{"path":"preaward/crosstrace_sprint4/README.md","sha256":"bbe8090e0bc2f08e245ba4218a467cf50e32a8038e6550b5dde251ea679ee1e1"},{"path":"preaward/crosstrace_sprint4/THREAT_TO_TEST.md","sha256":"7c76e5760544d9331e8b83f8515377b07294a7db1f0cfe4adb0d9cfaeae58635"},{"path":"preaward/crosstrace_sprint4/fixtures/development-v0.1.json","sha256":"d94c15fbde1ad6c0b9194235c85e41de93f335d0c7fd7c3d898806678dfec084"},{"path":"preaward/crosstrace_sprint4/schemas/six-cell-bundle.schema.json","sha256":"f316090e2f348f2d7d09c0b247b4b352a4a9ef4770740d9dfb9c8252389c126b"},{"path":"preaward/crosstrace_sprint4/schemas/six-cell-execution.schema.json","sha256":"dfa62de6695c196eab5ec26216588a41ed15a3b8dd15af377ffc13aca062201a"},{"path":"preaward/crosstrace_sprint4/schemas/six-cell-manifest.schema.json","sha256":"e047d3ce1539ad4bbebad28651e5b1fe43fadf80f83682c9b317925a43187ad0"},{"path":"src/crosstrace_sketch/__init__.py","sha256":"6f2ef7942b3be1fbeef6990c478425638278f4873fa12f9e4a80af56afce26c3"},{"path":"src/crosstrace_sketch/protocol.py","sha256":"6514c36275b2e50666ed65e5850e9a3ba8ab8750dbd6a6b8547fc363407dadaa"},{"path":"THREAT_MODEL.md","sha256":"ab1b4865800fdaf3c9b03efeeedf6900e25eb9f8f319ee4d5ea39d94610d3a6f"},{"path":"tests/test_delivery.py","sha256":"4cb5073469c563324527f9b9607eee5bcb9a2c6418c76d78690385dcb012ea02"},{"path":"tests/test_sprint2_evidence.py","sha256":"2252863fa8fdee90467c780230ecc070ef0476b2954a24286fe299355b915b64"},{"path":"tests/test_sprint3_common_gate.py","sha256":"1ba4aa1cdcb099e4005f3f834bfd64407b6ec686f4479dd7213d88a18781de1a"},{"path":"tests/test_sprint4_harness.py","sha256":"ad1423266a6741b91e3e5ee724f917dbf7b2239c25fdfe3a5a70dc4c8efe19c2"},{"path":"schema/authority-status.schema.json","sha256":"fcd166a6f061e970d3d9869aa23feae3bcea9d90fa0e16cbf775ea66574fbc64"},{"path":"schema/common-gate-input.schema.json","sha256":"c68f3de02d4f413c13f2f3cc5e19fbd166720d00aad85ff264734477e2c29acf"},{"path":"schema/common-gate-decision.schema.json","sha256":"e31e0bc05fc675a53053c4af01e08bc9078564c87155792d7eac2d3afd23ce99"},{"path":"schema/neutral-permit-state.schema.json","sha256":"2932cf1b1606c34cfda21f4abaed882f1b281e2030a5b40d600dda4802519081"},{"path":"schema/delivery-observation.schema.json","sha256":"cd66637f74f86872b9689d437f8b5690818c3d861c23238f3d331210b86ed699"},{"path":"schema/delivery-schedule.schema.json","sha256":"0075f4482f656ad6374208752c918241f9daa78a013da9d2771ed729b32472fc"},{"path":"schema/evidence-message.schema.json","sha256":"4612e71634bdbed19768d1072b00185d88536dd4077e3350ab834f9a79983c9d"},{"path":"schema/handoff-receipt.schema.json","sha256":"316f5a17abfd3ab208679953dcf09534e9695a6c797971b3b78b1ee06d72960f"},{"path":"schema/neutral-handoff.schema.json","sha256":"b18511656626d6bcd8e33d6638bcba89b2e1c2a2c36b1a7375eaa69bdcf1ff79"},{"path":"schema/payment-action.schema.json","sha256":"7ff337eaca5309149822c03dafb43e415b7751c125a9239516fd21308eebd65d"},{"path":"schema/signed-endpoint-record.schema.json","sha256":"651225cf71145a6d4e20ae30094f531aa56af62034e2940145240af791fdc273"},{"path":"schema/cross-referenced-record.schema.json","sha256":"f352d4ad692778c55ec29b2b6cc08c1b30576a86f4af07b0102354747d057e44"},{"path":"schema/validated-handoff.schema.json","sha256":"624d9d37670595411d71c9ef0aacc2940e377f1ccfb3d7e7a26969f27097ea0b"}],"source_tree_hash":"sha256:6c08623a128cf7e24daa93a9bd75893efefc5544e9341bdd930fa344cda3bf0b","unit":"one synthetic fixture encoding and enforcement branch","version":"crosstrace-six-cell/0.1"}
